{
 "format": "loopback_expected",
 "version": 1,
 "generated": "2026-10-05T15:52:37.637-06:00",
 "mode": "hardware",
 "pattern": {
  "name": "loopback_v1",
  "path": "patterns/loopback_v1.json",
  "sha256": "d517bd690be3e8225a689582f0162cee2ba95ddddf928d9c14223c6322ba5618"
 },
 "rig": {
  "rig": {
   "name": "loopback-h533",
   "default_scl_hz": 100000,
   "rise_ns": 300,
   "fall_ns": 30
  },
  "master": {
   "peripheral": "I2C1",
   "own_address": 8
  },
  "responder": [
   {
    "name": "R1",
    "id": 1,
    "peripheral": "I2C2",
    "address": 107,
    "enabled": true,
    "word_base": 40960
   },
   {
    "name": "R2",
    "id": 2,
    "peripheral": "I2C3",
    "address": 85,
    "enabled": true,
    "word_base": 45056
   }
  ],
  "nak": {
   "name": "NAK",
   "addresses": [
    8
   ]
  },
  "compare": {
   "timestamp_skew_ms": 50,
   "scl_tolerance_pct": 5
  },
  "ports": {
   "dut": ""
  }
 },
 "dut": {
  "hello": "HELLO LBDUT proto=1 fw=0.2 kernel=64000000",
  "port": "NUCLEO-H533"
 },
 "cases": [
  {
   "id": "LB-01",
   "description": "1-byte pointer write + repeated-START read of 2 bytes (baseline indexed_read pairing). Expect W [02], Sr R [02 A0].",
   "review_ids": [
    "B32"
   ],
   "status": "expect_pass",
   "expect": {
    "phases_per_iteration": 2,
    "scl_check": true
   },
   "path_status": {
    "ad2": "xfail",
    "ion": "expect_pass"
   },
   "xfail_reason": "B32 (AD2 path): a write phase that ends in a repeated START is exported as `0x00 W [00]` instead of the real pointer write (162 of 212 in run 2), so the pointer phase is missing and a spurious 0x00 row appears.",
   "xfail_symptoms": [
    "phase_extra",
    "phase_missing"
   ],
   "path_xfail_symptoms": {
    "ad2": [
     "phase_missing",
     "phase_extra"
    ]
   },
   "speed_hz": 100000,
   "speed_pred_hz": 100075,
   "repeat": 1,
   "emit_status": "ok",
   "iterations": [
    {
     "iter": 0,
     "t_host": 1791237157.66453,
     "t_dut_us": 259453142,
     "result": "OK",
     "phases": [
      {
       "start": "S",
       "address": 107,
       "dir": "W",
       "ack": "A",
       "stop": false,
       "data": [
        2
       ],
       "pec": false
      },
      {
       "start": "Sr",
       "address": 107,
       "dir": "R",
       "ack": "A",
       "stop": true,
       "data": [
        2,
        160
       ],
       "pec": false
      }
     ]
    }
   ]
  },
  {
   "id": "LB-02",
   "description": "1-byte pointer write + STOP, then a plain read (BQ25731 host style, stop-separated pointer). Expect W [04] P, S R [04 A0] P.",
   "review_ids": [],
   "status": "expect_pass",
   "expect": {
    "phases_per_iteration": 2,
    "scl_check": true
   },
   "speed_hz": 100000,
   "speed_pred_hz": 100075,
   "repeat": 1,
   "emit_status": "ok",
   "iterations": [
    {
     "iter": 0,
     "t_host": 1791237157.688483,
     "t_dut_us": 259477167,
     "result": "OK",
     "phases": [
      {
       "start": "S",
       "address": 107,
       "dir": "W",
       "ack": "A",
       "stop": true,
       "data": [
        4
       ],
       "pec": false
      },
      {
       "start": "S",
       "address": 107,
       "dir": "R",
       "ack": "A",
       "stop": true,
       "data": [
        4,
        160
       ],
       "pec": false
      }
     ]
    }
   ]
  },
  {
   "id": "LB-03",
   "description": "Indexed write: register 0x10 + 2 data bytes (34 12). Expect one W phase [10 34 12] P.",
   "review_ids": [],
   "status": "expect_pass",
   "expect": {
    "phases_per_iteration": 1,
    "scl_check": true
   },
   "speed_hz": 100000,
   "speed_pred_hz": 100075,
   "repeat": 1,
   "emit_status": "ok",
   "iterations": [
    {
     "iter": 0,
     "t_host": 1791237157.7123442,
     "t_dut_us": 259501176,
     "result": "OK",
     "phases": [
      {
       "start": "S",
       "address": 107,
       "dir": "W",
       "ack": "A",
       "stop": true,
       "data": [
        16,
        52,
        18
       ],
       "pec": false
      }
     ]
    }
   ]
  },
  {
   "id": "LB-04",
   "description": "Single-byte write with STOP and no read following. With a loopback decoder that has a simple_write rule for register 0x20 on R1, the row must decode as that simple write.",
   "review_ids": [
    "B8"
   ],
   "status": "xfail",
   "expect": {
    "phases_per_iteration": 1,
    "decode": {
     "phase": 0,
     "contains": "LB simple write = 0x20"
    },
    "note": "Raw bytes must still match exactly; only the decode check is xfail."
   },
   "xfail_reason": "B8: _is_pointer_write() is True for every 1-byte write, so the simple_write branch never runs; the W [20] row's Decode column is empty (the byte is stashed as a pending register) instead of the simple_write rule's text.",
   "xfail_symptoms": [
    "decode_mismatch"
   ],
   "requires": [
    "loopback_decoder"
   ],
   "speed_hz": 100000,
   "speed_pred_hz": 100075,
   "repeat": 1,
   "emit_status": "ok",
   "iterations": [
    {
     "iter": 0,
     "t_host": 1791237157.733939,
     "t_dut_us": 259522231,
     "result": "OK",
     "phases": [
      {
       "start": "S",
       "address": 107,
       "dir": "W",
       "ack": "A",
       "stop": true,
       "data": [
        32
       ],
       "pec": false
      }
     ]
    }
   ]
  },
  {
   "id": "LB-05",
   "description": "Write to the address-NAK target (rig.toml [nak], default 0x08 = I2C1's own address with matching disabled). Expect one W phase with an address NAK and no data.",
   "review_ids": [],
   "status": "expect_pass",
   "expect": {
    "phases_per_iteration": 1,
    "address_nak": true
   },
   "speed_hz": 100000,
   "speed_pred_hz": 100075,
   "repeat": 1,
   "emit_status": "ok",
   "iterations": [
    {
     "iter": 0,
     "t_host": 1791237157.754328,
     "t_dut_us": 259542624,
     "result": "NAK",
     "phases": [
      {
       "start": "S",
       "address": 8,
       "dir": "W",
       "ack": "NA",
       "stop": true,
       "data": [],
       "pec": false
      }
     ]
    }
   ]
  },
  {
   "id": "LB-06",
   "description": "Read of 4 bytes from pointer 0x02 ending in the master's normal final-byte NAK. Expect Sr R [02 A0 03 A0] P; the end-of-read NAK must not be presented as an error.",
   "review_ids": [
    "B13",
    "B32"
   ],
   "status": "xfail",
   "expect": {
    "phases_per_iteration": 2,
    "end_of_read_nak": "strict"
   },
   "xfail_reason": "B13: the normal master NAK on the final read byte is exported as NAK=\"NAK\" (and coloured as an error) on the read row, indistinguishable from an address/data NAK. B32 (AD2 path): a write phase that ends in a repeated START is exported as `0x00 W [00]` instead of the real pointer write (162 of 212 in run 2), so the pointer phase is missing and a spurious 0x00 row appears.",
   "xfail_symptoms": [
    "nak_on_normal_end_of_read",
    "phase_extra",
    "phase_missing"
   ],
   "path_xfail_symptoms": {
    "ion": [
     "nak_on_normal_end_of_read"
    ],
    "ad2": [
     "nak_on_normal_end_of_read",
     "phase_missing",
     "phase_extra"
    ]
   },
   "speed_hz": 100000,
   "speed_pred_hz": 100075,
   "repeat": 1,
   "emit_status": "ok",
   "iterations": [
    {
     "iter": 0,
     "t_host": 1791237157.77456,
     "t_dut_us": 259563125,
     "result": "OK",
     "phases": [
      {
       "start": "S",
       "address": 107,
       "dir": "W",
       "ack": "A",
       "stop": false,
       "data": [
        2
       ],
       "pec": false
      },
      {
       "start": "Sr",
       "address": 107,
       "dir": "R",
       "ack": "A",
       "stop": true,
       "data": [
        2,
        160,
        3,
        160
       ],
       "pec": false
      }
     ]
    }
   ]
  },
  {
   "id": "LB-07",
   "description": "SMBus read-word with PEC: W [08], Sr R [08 A0 PEC], where PEC = CRC-8 over D6 08 D7 08 A0 (Addr+W, command, Addr+R, data). With sniffer PEC validation on, the read row must show a valid PEC.",
   "review_ids": [
    "B9",
    "B32"
   ],
   "status": "xfail",
   "expect": {
    "phases_per_iteration": 2,
    "pec": "valid"
   },
   "xfail_reason": "B9: the sniffer computes PEC over the read phase only (Addr+R + data) instead of the combined transaction, so the read row shows PEC invalid (\u2717 PEC) although the bus PEC is correct. B32 (AD2 path): a write phase that ends in a repeated START is exported as `0x00 W [00]` instead of the real pointer write (162 of 212 in run 2), so the pointer phase is missing and a spurious 0x00 row appears.",
   "xfail_symptoms": [
    "pec_invalid",
    "phase_extra",
    "phase_missing"
   ],
   "path_xfail_symptoms": {
    "ion": [
     "pec_invalid"
    ],
    "ad2": [
     "pec_invalid",
     "phase_missing",
     "phase_extra"
    ]
   },
   "requires": [
    "pec_validation_on"
   ],
   "speed_hz": 100000,
   "speed_pred_hz": 100075,
   "repeat": 1,
   "emit_status": "ok",
   "iterations": [
    {
     "iter": 0,
     "t_host": 1791237157.799073,
     "t_dut_us": 259590448,
     "result": "OK",
     "phases": [
      {
       "start": "S",
       "address": 107,
       "dir": "W",
       "ack": "A",
       "stop": false,
       "data": [
        8
       ],
       "pec": false
      },
      {
       "start": "Sr",
       "address": 107,
       "dir": "R",
       "ack": "A",
       "stop": true,
       "data": [
        8,
        160,
        110
       ],
       "pec": true
      }
     ]
    }
   ]
  },
  {
   "id": "LB-08",
   "description": "SMBus write-byte with PEC: W [0A 5A PEC], PEC over D6 0A 5A. A single-phase PEC is computed over the right bytes even with B9 present, so this is expected to pass; if it fails, that is a new finding.",
   "review_ids": [
    "B9"
   ],
   "status": "expect_pass",
   "expect": {
    "phases_per_iteration": 1,
    "pec": "valid"
   },
   "requires": [
    "pec_validation_on"
   ],
   "speed_hz": 100000,
   "speed_pred_hz": 100075,
   "repeat": 1,
   "emit_status": "ok",
   "iterations": [
    {
     "iter": 0,